{
  "schema": "mucaro-video-cli-parity-denominator/1.0",
  "denominator_id": "VIDEO_CLI_PARITY_V1",
  "frozen_date": "2026-10-02",
  "baseline_main_sha": "7f104bf9114c85df92c24eeaecaf2260465b4568",
  "source_manifest": {
    "kind": "USER_SUPPLIED_VIDEO",
    "filename": "Screen Recording 2026-10-02 at 12.02.07 AM.mp4",
    "sha256": "6d7fcce3581fd2e3c06b30b5f671c40f9f9b5654ab9251df575b70f4e69f4d0f",
    "duration_seconds": 36.866667,
    "video_codec": "h264",
    "width": 606,
    "height": 512,
    "frame_rate": "30/1"
  },
  "scope": "Capabilities observably demonstrated in the frozen 36.866667-second recording. This denominator does not claim universal parity with undisclosed source-product behavior.",
  "closure_rule": "Every required capability must be IMPLEMENTED and certification PASS for one exact Mucaro source SHA, with positive and negative execution evidence and zero unresolved residue inside this denominator.",
  "capabilities": [
    {"id":"VCP-001","capability":"persistent_terminal_agent_session","required":true,"flagpole_domains":["V02","V07","V21"],"observed_behavior":"A durable interactive agent session remains active while work proceeds and state changes are rendered in the terminal."},
    {"id":"VCP-002","capability":"repository_inspection","required":true,"flagpole_domains":["V05","V13"],"observed_behavior":"The agent inspects repository/workspace state as part of the active coding workflow."},
    {"id":"VCP-003","capability":"project_file_read","required":true,"flagpole_domains":["V05","V13"],"observed_behavior":"The agent reads project files during task execution."},
    {"id":"VCP-004","capability":"project_file_edit","required":true,"flagpole_domains":["V05","V13"],"observed_behavior":"The agent edits project source during an execution run."},
    {"id":"VCP-005","capability":"diff_inspection","required":true,"flagpole_domains":["V05","V13"],"observed_behavior":"Repository changes can be inspected as diffs during the coding workflow."},
    {"id":"VCP-006","capability":"governed_command_execution","required":true,"flagpole_domains":["V05","V06","V07"],"observed_behavior":"The agent executes commands from the coding session instead of only generating instructions."},
    {"id":"VCP-007","capability":"operator_question_and_resume","required":true,"flagpole_domains":["V02","V07","V21"],"observed_behavior":"The agent can pause for an operator choice and continue the same run after the answer."},
    {"id":"VCP-008","capability":"plan_only_mode","required":true,"flagpole_domains":["V07","V21"],"observed_behavior":"A plan can be prepared and reviewed without executing its actions."},
    {"id":"VCP-009","capability":"interactive_execution_mode","required":true,"flagpole_domains":["V06","V07","V21"],"observed_behavior":"The operator can execute the plan interactively with pauses at permission or decision boundaries."},
    {"id":"VCP-010","capability":"autopilot_execution_mode","required":true,"flagpole_domains":["V07","V08","V21"],"observed_behavior":"The operator can choose an autonomous execution mode that continues across plan steps."},
    {"id":"VCP-011","capability":"todo_dependency_runtime","required":true,"flagpole_domains":["V07","V08"],"observed_behavior":"The plan is represented as live task/todo state whose dependencies and progress change during execution."},
    {"id":"VCP-012","capability":"per_tool_approval","required":true,"flagpole_domains":["V05","V06"],"observed_behavior":"Tool/action execution can stop at an explicit operator approval boundary."},
    {"id":"VCP-013","capability":"run_scoped_authorization","required":true,"flagpole_domains":["V06","V08"],"observed_behavior":"The operator can authorize a bounded execution scope for the active run rather than approving every action individually."},
    {"id":"VCP-014","capability":"interrupt_and_stop","required":true,"flagpole_domains":["V02","V07","V21"],"observed_behavior":"An active execution can be interrupted from the terminal without destroying session state."},
    {"id":"VCP-015","capability":"resume_and_recovery","required":true,"flagpole_domains":["V02","V07","V18"],"observed_behavior":"Interrupted or paused work can resume with prior progress preserved."},
    {"id":"VCP-016","capability":"sessions_browser","required":true,"flagpole_domains":["V02","V21"],"observed_behavior":"Saved sessions are accessible from a terminal-native Sessions surface."},
    {"id":"VCP-017","capability":"current_session_surface","required":true,"flagpole_domains":["V07","V21"],"observed_behavior":"The terminal exposes a dedicated Current view for the active agent run."},
    {"id":"VCP-018","capability":"github_issues_surface","required":true,"flagpole_domains":["V13","V21"],"observed_behavior":"GitHub issues are accessible from the terminal agent surface."},
    {"id":"VCP-019","capability":"github_pull_requests_surface","required":true,"flagpole_domains":["V13","V21"],"observed_behavior":"Pull requests are accessible from the terminal agent surface."},
    {"id":"VCP-020","capability":"github_gists_surface","required":true,"flagpole_domains":["V13","V21"],"observed_behavior":"Gists are accessible from the terminal agent surface."},
    {"id":"VCP-021","capability":"branch_commit_lifecycle","required":true,"flagpole_domains":["V05","V06","V13"],"observed_behavior":"The coding agent can create or use branches and create commits under explicit authority."},
    {"id":"VCP-022","capability":"regression_execution","required":true,"flagpole_domains":["V05","V13","V19"],"observed_behavior":"The agent can execute applicable tests/regression gates and use their results during the run."},
    {"id":"VCP-023","capability":"ci_status_inspection","required":true,"flagpole_domains":["V13","V19"],"observed_behavior":"The agent can inspect CI/check status as part of the repository workflow."},
    {"id":"VCP-024","capability":"pull_request_open_update","required":true,"flagpole_domains":["V06","V13"],"observed_behavior":"The agent can open or update a pull request where authorized."},
    {"id":"VCP-025","capability":"model_mode_status","required":true,"flagpole_domains":["V04","V21"],"observed_behavior":"The active model and execution mode are visible in the terminal session."},
    {"id":"VCP-026","capability":"context_usage_status","required":true,"flagpole_domains":["V03","V04","V21"],"observed_behavior":"The terminal exposes live context or token-usage status for the active session."},
    {"id":"VCP-027","capability":"persistent_full_screen_tui","required":true,"flagpole_domains":["V21"],"observed_behavior":"The capabilities are integrated into one persistent full-screen terminal user interface rather than isolated one-shot subcommands."}
  ]
}
